{
  "$schema": "../schemas/contract.schema.json",
  "schema_version": "3.0.0",
  "contract_version": "5.1.0",
  "id": "keyboard-suggestions",
  "description": "Compact corrections and optional next-text suggestions for bounded keyboard context.",
  "system_instruction": "You are a writing assistant. Return strict JSON only.",
  "user_message_template": "{{numbered_rules}}\n{\"bounded_context\":{{input_json}}}",
  "rule_line_template": "{{rule}}",
  "input": {
    "parameter": "bounded_context",
    "required": true,
    "encoding": "json_string",
    "trust": "untrusted_data",
    "max_characters": 500,
    "max_characters_unit": "unicode_scalar"
  },
  "response": {
    "format": "prompt_only_json",
    "schema": "../schemas/keyboard-suggestions-response.schema.json",
    "top_level_example": "{\"corrections\":[{\"label\":\"Correct capitalization\",\"original\":\"i\",\"replacement\":\"I\",\"explanation\":\"Capitalize the pronoun I.\",\"category\":\"capitalization\"}],\"predictions\":[{\"label\":\"Suggestion\",\"text\":\"apple\",\"kind\":\"nextWord\"}]}"
  },
  "operations": [
    {
      "id": "keyboard_suggestions",
      "wire_operation_id": null,
      "description": "Analyze bounded keyboard context for compact corrections and predictions.",
      "parameters": [],
      "max_tokens": 1200,
      "result_types": ["correction", "prediction"],
      "rules": [
        "Analyze this bounded keyboard context and return strict JSON only. Do not include markdown or explanations outside JSON.",
        "Return corrections and predictions separately using this schema:",
        "{{response_example}}",
        "A correction fixes one definite local error in existing text: a misspelling, capitalization or punctuation mistake, missing or extra short function word, or unambiguous agreement or word-form error. Copy original exactly from the context and keep replacement to the smallest possible edit, normally one word and never more than three words.",
        "Do not use corrections to rewrite, improve style, change tone, increase formality, or replace valid wording with a synonym. Put optional next-word, phrase, or synonym ideas in predictions instead. If uncertain whether existing text is wrong, omit the correction.",
        "Keep correction replacements and prediction text short for a compact keyboard bar."
      ],
      "no_change_behavior": "Return empty corrections and predictions arrays when no usable suggestion exists."
    }
  ]
}
